{
  "D:\\Programacion\\IT-Rock\\serverless.yml": {
    "versionFramework": "4.33.0",
    "servicePath": "D:\\Programacion\\IT-Rock\\serverless.yml",
    "serviceConfigFileName": "serverless.yml",
    "service": {
      "service": "it-rock-challenge",
      "useDotenv": true,
      "provider": {
        "name": "aws",
        "runtime": "nodejs20.x",
        "region": "us-east-1",
        "environment": {
          "JWT_SECRET": "<REDACTED>"
        }
      },
      "plugins": [
        "serverless-offline"
      ],
      "custom": {
        "serverless-offline": {
          "httpPort": 3000,
          "noPrependStageInUrl": true
        }
      },
      "functions": {
        "login": {
          "handler": "src/handlers/auth.handleLogin",
          "events": [
            {
              "http": {
                "path": "/login",
                "method": "post"
              }
            }
          ]
        },
        "getTasks": {
          "handler": "src/handlers/tasks.handleGetAll",
          "events": [
            {
              "http": {
                "path": "/task",
                "method": "get"
              }
            }
          ]
        },
        "importTasks": {
          "handler": "src/handlers/tasks.handleImportFromApi",
          "events": [
            {
              "http": {
                "path": "/task/import",
                "method": "post"
              }
            }
          ]
        },
        "createTask": {
          "handler": "src/handlers/tasks.handleCreate",
          "events": [
            {
              "http": {
                "path": "/task",
                "method": "post"
              }
            }
          ]
        },
        "updateTask": {
          "handler": "src/handlers/tasks.handleUpdate",
          "events": [
            {
              "http": {
                "path": "/task/{id}",
                "method": "patch"
              }
            }
          ]
        },
        "removeTask": {
          "handler": "src/handlers/tasks.handleRemove",
          "events": [
            {
              "http": {
                "path": "/task/{id}",
                "method": "delete"
              }
            }
          ]
        }
      }
    },
    "provider": {
      "name": "aws",
      "runtime": "nodejs20.x",
      "region": "us-east-1",
      "environment": {
        "JWT_SECRET": "<REDACTED>"
      }
    },
    "dashboard": {
      "isEnabledForService": false,
      "requiredAuthentication": false,
      "orgFeaturesInUse": null,
      "orgObservabilityIntegrations": null,
      "serviceAppId": null,
      "serviceProvider": null,
      "instanceParameters": null
    },
    "serviceRawFile": "service: it-rock-challenge\r\n\r\nuseDotenv: true\r\n\r\nprovider:\r\n  name: aws\r\n  runtime: nodejs20.x\r\n  region: us-east-1\r\n  environment:\r\n    JWT_SECRET: ${env:JWT_SECRET}\r\n\r\nplugins:\r\n  - serverless-offline\r\n\r\ncustom:\r\n  serverless-offline:\r\n    httpPort: 3000\r\n    noPrependStageInUrl: true\r\n\r\nfunctions:\r\n  login:\r\n    handler: src/handlers/auth.handleLogin\r\n    events:\r\n      - http:\r\n          path: /login\r\n          method: post\r\n\r\n  getTasks:\r\n    handler: src/handlers/tasks.handleGetAll\r\n    events:\r\n      - http:\r\n          path: /task\r\n          method: get\r\n\r\n  importTasks:\r\n    handler: src/handlers/tasks.handleImportFromApi\r\n    events:\r\n      - http:\r\n          path: /task/import\r\n          method: post\r\n\r\n  createTask:\r\n    handler: src/handlers/tasks.handleCreate\r\n    events:\r\n      - http:\r\n          path: /task\r\n          method: post\r\n\r\n  updateTask:\r\n    handler: src/handlers/tasks.handleUpdate\r\n    events:\r\n      - http:\r\n          path: /task/{id}\r\n          method: patch\r\n\r\n  removeTask:\r\n    handler: src/handlers/tasks.handleRemove\r\n    events:\r\n      - http:\r\n          path: /task/{id}\r\n          method: delete\r\n\r\n",
    "command": [
      "login"
    ],
    "options": {},
    "orgId": "f857ad63-37e5-4aad-9ff7-4aa51f8be1e6",
    "orgName": "joaquinitrock",
    "userId": "gzl1ddnxgWVMgSCPly",
    "userName": "joaquinitrock",
    "serviceProviderAwsCfStackId": null,
    "serviceProviderAwsCfStackCreated": null,
    "serviceProviderAwsCfStackUpdated": null,
    "serviceProviderAwsCfStackStatus": null,
    "serviceProviderAwsCfStackOutputs": null
  }
}